{"$schema":"https://json-schema.org/draft/2020-12/schema","$id":"https://synapse.kkloudtarus.net/docs/schemas/events/finding.created.v1.schema.json","title":"finding.created event (v1)","type":"object","properties":{"id":{"type":"string","minLength":1},"type":{"type":"string","const":"finding.created"},"source_kind":{"type":"string","minLength":1},"source_id":{"type":"string","minLength":1},"schema_version":{"type":"integer","const":1},"occurred_at":{"type":"string","format":"date-time"},"engagement_id":{"type":"string"},"severity":{"type":"string"},"data":{"type":"object","properties":{"title":{"type":"string"},"summary":{"type":"string"},"finding_id":{"type":"string","minLength":1},"engagement_id":{"type":"string","minLength":1},"finding_kind":{"type":"string","minLength":1},"status":{"type":"string","minLength":1},"finding_version":{"type":"integer","minimum":1},"assignee_user_id":{"type":"string"},"team_id":{"type":"string"},"actor_user_id":{"type":"string"}},"required":["title","summary","finding_id","engagement_id","finding_kind","status","finding_version"],"additionalProperties":true}},"required":["id","type","source_kind","source_id","schema_version","occurred_at","data"],"additionalProperties":true}
