{"id":"event-finding-created","type":"finding.created","source_kind":"finding","source_id":"finding-42:v1","schema_version":1,"occurred_at":"2026-10-10T08:00:00.123456789Z","engagement_id":"eng-42","severity":"high","data":{"title":"Finding created","summary":"A new finding was recorded.","finding_id":"finding-42","engagement_id":"eng-42","finding_kind":"sast","status":"open","finding_version":1,"assignee_user_id":"user-42","team_id":"team-42","actor_user_id":"user-7"}}
